{
  "fixture_schema_version": "pricing_fixture_v1",
  "engine_version": "pricing_engine_v1",
  "formula_version": "ec9_current",
  "category": "apparel",
  "case_id": "apparel_normal",
  "description": "Apparel normal line fixture for Gildan 5000 short sleeve tees at quantity 25.",
  "case_scope": "normal_line",
  "applicable_adapters": ["legacy_saas_calculator_v1"],
  "normalized_inputs": {
    "calculator_request": {
      "width": null,
      "height": null,
      "quantity": {"value": "25.0000", "unit": "each"},
      "material_key": null,
      "design_needed": false,
      "install_needed": false,
      "manual_selling_price_cents": null,
      "category_inputs": {"garment_type": "short_sleeve_tee", "brand": "gildan_5000", "placement": "front_small"}
    }
  },
  "normalized_configuration": {
    "configuration_source": "starter_defaults",
    "starter_default_version": "1.2.1"
  },
  "expected_line_results": {
    "status": "success",
    "selling_price_cents": 25652,
    "suggested_price_cents": 25652,
    "true_cost_cents": 11931,
    "profit_amount_cents": 13721,
    "profit_margin_percent": "53.4900",
    "pricing_method_used": "apparel_table",
    "canonical_method_id": "apparel_table",
    "selected_method_id": "apparel_table",
    "warnings": [],
    "method_rows": [
      {"method_id": "apparel_table", "selected": true, "available": true, "amount_cents": 25652, "status": ["selected", "authoritative_total"]}
    ]
  },
  "expected_document_results": {
    "applicability": "not_applicable",
    "status": "not_calculated",
    "total_cents": null
  },
  "decimal_rate_evidence": [
    {"field": "quantity", "value": "25.0000", "unit": "each", "source": "fixture input"},
    {"field": "blank_cost", "value": "3.250000", "unit": "USD_per_each", "source": "starter defaults"},
    {"field": "front_small_tier_sell_price", "value": "9.000000", "unit": "USD_per_each", "source": "starter defaults"}
  ],
  "rounding_evidence": {
    "policy_id": "pricing_rounding_v1_round_half_up_final_cents",
    "mode": "ROUND_HALF_UP",
    "boundary": "final_cents",
    "legacy_dollar_bridge": "Decimal(str(value))"
  },
  "minimum_adjustment_evidence": {
    "applicability": "not_applicable",
    "minimum_charge_applied": false,
    "minimum_scope": null,
    "minimum_policy": null,
    "pre_minimum_selling_price_cents": null,
    "minimum_adjustment_cents": null
  },
  "expected_validation_errors": [],
  "snapshot_evidence": {
    "applicability": "shape_only",
    "snapshot_created": false,
    "legacy_readable": true,
    "expected_shape": ["source", "pricing_method", "calculated_unit_price_cents"]
  },
  "legacy_compatibility": {
    "adapter_id": "legacy_saas_calculator_v1",
    "execution_path": "app.services.pricing.calculate_pricing",
    "source": "legacy compatibility value",
    "legacy_dollar_fields": ["selling_price", "suggested_price", "true_cost", "profit_amount"]
  }
}
