{
  "fixture_schema_version": "pricing_fixture_v1",
  "engine_version": "pricing_engine_v1",
  "formula_version": "ec9_current",
  "category": "digital_print",
  "case_id": "digital_print_normal",
  "description": "Digital Print normal line fixture with laminate, photo quality, and contour cut.",
  "case_scope": "normal_line",
  "applicable_adapters": ["legacy_saas_calculator_v1"],
  "normalized_inputs": {
    "calculator_request": {
      "width": {"value": "24.0000", "unit": "in"},
      "height": {"value": "36.0000", "unit": "in"},
      "quantity": {"value": "1.0000", "unit": "each"},
      "material_key": null,
      "design_needed": false,
      "install_needed": false,
      "manual_selling_price_cents": null,
      "category_inputs": {"laminate": true, "quality_mode": "photo", "contour_cut": true}
    }
  },
  "normalized_configuration": {
    "configuration_source": "starter_defaults",
    "starter_default_version": "1.2.1"
  },
  "expected_line_results": {
    "status": "success",
    "selling_price_cents": 6283,
    "suggested_price_cents": 6283,
    "true_cost_cents": 2732,
    "profit_amount_cents": 3551,
    "profit_margin_percent": "56.5200",
    "pricing_method_used": "per_sqft",
    "canonical_method_id": "per_sqft",
    "selected_method_id": "per_sqft",
    "warnings": ["Digital Print order minimum is evaluated once at Quote or Order document level."],
    "method_rows": [
      {"method_id": "per_sqft", "selected": true, "available": true, "amount_cents": 6283, "status": ["selected", "authoritative_total"]}
    ]
  },
  "expected_document_results": {
    "applicability": "not_applicable",
    "status": "not_calculated",
    "total_cents": null
  },
  "decimal_rate_evidence": [
    {"field": "width", "value": "24.0000", "unit": "in", "source": "fixture input"},
    {"field": "height", "value": "36.0000", "unit": "in", "source": "fixture input"},
    {"field": "quantity", "value": "1.0000", "unit": "each", "source": "fixture input"},
    {"field": "base_sell_rate_per_sqft", "value": "9.500000", "unit": "USD_per_sqft", "source": "starter defaults"}
  ],
  "rounding_evidence": {
    "policy_id": "pricing_rounding_v1_round_half_up_final_cents",
    "mode": "ROUND_HALF_UP",
    "boundary": "final_cents",
    "legacy_dollar_bridge": "Decimal(str(value))"
  },
  "minimum_adjustment_evidence": {
    "applicability": "applicable",
    "minimum_charge_applied": false,
    "minimum_scope": "digital_print_line_item",
    "minimum_policy": "digital_print_item_minimum_document_order_minimum",
    "pre_minimum_selling_price_cents": 6283,
    "minimum_adjustment_cents": 0
  },
  "expected_validation_errors": [],
  "snapshot_evidence": {
    "applicability": "shape_only",
    "snapshot_created": false,
    "legacy_readable": true,
    "expected_shape": ["source", "pricing_method", "calculated_unit_price_cents", "minimum_policy"]
  },
  "legacy_compatibility": {
    "adapter_id": "legacy_saas_calculator_v1",
    "execution_path": "app.services.pricing.calculate_pricing",
    "source": "legacy compatibility value",
    "legacy_dollar_fields": ["selling_price", "suggested_price", "true_cost", "profit_amount"]
  }
}
