{
  "fixture_schema_version": "pricing_fixture_v1",
  "engine_version": "pricing_engine_v1",
  "formula_version": "ec9_current",
  "category": "promotional",
  "case_id": "promotional_normal",
  "description": "Promotional normal line fixture using per-piece supplier cost and explicit unit price.",
  "case_scope": "normal_line",
  "applicable_adapters": ["legacy_saas_calculator_v1"],
  "normalized_inputs": {
    "calculator_request": {
      "width": null,
      "height": null,
      "quantity": {"value": "100.0000", "unit": "each"},
      "material_key": null,
      "design_needed": false,
      "install_needed": false,
      "manual_selling_price_cents": null,
      "category_inputs": {"pricing_method": "per_piece", "unit_price": "2.50", "unit_cost": "1.00"}
    }
  },
  "normalized_configuration": {
    "configuration_source": "starter_defaults",
    "starter_default_version": "1.2.1"
  },
  "expected_line_results": {
    "status": "success",
    "selling_price_cents": 17250,
    "suggested_price_cents": 17250,
    "true_cost_cents": 11500,
    "profit_amount_cents": 5750,
    "profit_margin_percent": "33.3300",
    "pricing_method_used": "per_piece",
    "canonical_method_id": "per_piece",
    "selected_method_id": "per_piece",
    "warnings": [],
    "method_rows": [
      {"method_id": "per_piece", "selected": true, "available": true, "amount_cents": 17250, "status": ["selected", "authoritative_total"]}
    ]
  },
  "expected_document_results": {
    "applicability": "not_applicable",
    "status": "not_calculated",
    "total_cents": null
  },
  "decimal_rate_evidence": [
    {"field": "quantity", "value": "100.0000", "unit": "each", "source": "fixture input"},
    {"field": "unit_price", "value": "2.500000", "unit": "USD_per_each", "source": "fixture input"},
    {"field": "unit_cost", "value": "1.000000", "unit": "USD_per_each", "source": "fixture input"}
  ],
  "rounding_evidence": {
    "policy_id": "pricing_rounding_v1_round_half_up_final_cents",
    "mode": "ROUND_HALF_UP",
    "boundary": "final_cents",
    "legacy_dollar_bridge": "Decimal(str(value))"
  },
  "minimum_adjustment_evidence": {
    "applicability": "not_applicable",
    "minimum_charge_applied": false,
    "minimum_scope": null,
    "minimum_policy": null,
    "pre_minimum_selling_price_cents": null,
    "minimum_adjustment_cents": null
  },
  "expected_validation_errors": [],
  "snapshot_evidence": {
    "applicability": "shape_only",
    "snapshot_created": false,
    "legacy_readable": true,
    "expected_shape": ["source", "pricing_method", "calculated_unit_price_cents"]
  },
  "legacy_compatibility": {
    "adapter_id": "legacy_saas_calculator_v1",
    "execution_path": "app.services.pricing.calculate_pricing",
    "source": "legacy compatibility value",
    "legacy_dollar_fields": ["selling_price", "suggested_price", "true_cost", "profit_amount"]
  }
}
