{
  "fixture_schema_version": "pricing_fixture_v1",
  "engine_version": "pricing_engine_v1",
  "formula_version": "ec9_current",
  "category": "banners",
  "case_id": "banners_normal",
  "description": "Banner normal line fixture using the existing 8 ft by 3 ft square-foot-plus-add-ons path.",
  "case_scope": "normal_line",
  "applicable_adapters": ["legacy_saas_calculator_v1"],
  "normalized_inputs": {
    "calculator_request": {
      "width": {"value": "8.0000", "unit": "ft"},
      "height": {"value": "3.0000", "unit": "ft"},
      "quantity": {"value": "1.0000", "unit": "each"},
      "material_key": null,
      "design_needed": false,
      "install_needed": false,
      "manual_selling_price_cents": null,
      "category_inputs": {"dimension_unit": "ft"}
    }
  },
  "normalized_configuration": {
    "configuration_source": "starter_defaults",
    "starter_default_version": "1.2.1"
  },
  "expected_line_results": {
    "status": "success",
    "selling_price_cents": 19200,
    "suggested_price_cents": 19200,
    "true_cost_cents": 9964,
    "profit_amount_cents": 9236,
    "profit_margin_percent": "48.1100",
    "pricing_method_used": "square_foot_plus_addons",
    "canonical_method_id": null,
    "selected_method_id": null,
    "warnings": [],
    "method_rows": []
  },
  "expected_document_results": {
    "applicability": "not_applicable",
    "status": "not_calculated",
    "total_cents": null
  },
  "decimal_rate_evidence": [
    {"field": "width", "value": "8.0000", "unit": "ft", "source": "fixture input"},
    {"field": "height", "value": "3.0000", "unit": "ft", "source": "fixture input"},
    {"field": "quantity", "value": "1.0000", "unit": "each", "source": "fixture input"},
    {"field": "base_sell_rate_per_sqft", "value": "8.000000", "unit": "USD_per_sqft", "source": "starter defaults"}
  ],
  "rounding_evidence": {
    "policy_id": "pricing_rounding_v1_round_half_up_final_cents",
    "mode": "ROUND_HALF_UP",
    "boundary": "final_cents",
    "legacy_dollar_bridge": "Decimal(str(value))"
  },
  "minimum_adjustment_evidence": {
    "applicability": "not_applicable",
    "minimum_charge_applied": false,
    "minimum_scope": null,
    "minimum_policy": null,
    "pre_minimum_selling_price_cents": null,
    "minimum_adjustment_cents": null
  },
  "expected_validation_errors": [],
  "snapshot_evidence": {
    "applicability": "shape_only",
    "snapshot_created": false,
    "legacy_readable": true,
    "expected_shape": ["source", "pricing_method", "calculated_unit_price_cents"]
  },
  "legacy_compatibility": {
    "adapter_id": "legacy_saas_calculator_v1",
    "execution_path": "app.services.pricing.calculate_pricing",
    "source": "legacy compatibility value",
    "legacy_dollar_fields": ["selling_price", "suggested_price", "true_cost", "profit_amount"]
  }
}
