{
  "fixture_schema_version": "pricing_fixture_v1",
  "engine_version": "pricing_engine_v1",
  "formula_version": "ec9_current",
  "category": "vehicle_graphics",
  "case_id": "vehicle_graphics_normal",
  "description": "Vehicle Graphics normal line fixture for pickup partial coverage.",
  "case_scope": "normal_line",
  "applicable_adapters": ["legacy_saas_calculator_v1"],
  "normalized_inputs": {
    "calculator_request": {
      "width": null,
      "height": null,
      "quantity": {"value": "1.0000", "unit": "each"},
      "material_key": null,
      "design_needed": false,
      "install_needed": false,
      "manual_selling_price_cents": null,
      "category_inputs": {"vehicle_type": "pickup", "coverage_type": "partial"}
    }
  },
  "normalized_configuration": {
    "configuration_source": "starter_defaults",
    "starter_default_version": "1.2.1"
  },
  "expected_line_results": {
    "status": "success",
    "selling_price_cents": 180173,
    "suggested_price_cents": 180173,
    "true_cost_cents": 75072,
    "profit_amount_cents": 105101,
    "profit_margin_percent": "58.3300",
    "pricing_method_used": "vehicle_cost_plus",
    "canonical_method_id": "vehicle_cost_plus",
    "selected_method_id": "vehicle_cost_plus",
    "warnings": ["Wrap area is an ESTIMATE (70.0 sq ft = Pickup base 175 sq ft x 40.0% coverage) \u2014 override `estimated_sqft_override` with a measured value if known."],
    "method_rows": [
      {"method_id": "vehicle_cost_plus", "selected": true, "available": true, "amount_cents": 180173, "status": ["selected", "authoritative_total"]}
    ]
  },
  "expected_document_results": {
    "applicability": "not_applicable",
    "status": "not_calculated",
    "total_cents": null
  },
  "decimal_rate_evidence": [
    {"field": "quantity", "value": "1.0000", "unit": "each", "source": "fixture input"},
    {"field": "estimated_area", "value": "70.0000", "unit": "sqft", "source": "legacy calculator output"},
    {"field": "coverage_percent", "value": "40.000000", "unit": "percent", "source": "starter defaults"}
  ],
  "rounding_evidence": {
    "policy_id": "pricing_rounding_v1_round_half_up_final_cents",
    "mode": "ROUND_HALF_UP",
    "boundary": "final_cents",
    "legacy_dollar_bridge": "Decimal(str(value))"
  },
  "minimum_adjustment_evidence": {
    "applicability": "not_applicable",
    "minimum_charge_applied": false,
    "minimum_scope": null,
    "minimum_policy": null,
    "pre_minimum_selling_price_cents": null,
    "minimum_adjustment_cents": null
  },
  "expected_validation_errors": [],
  "snapshot_evidence": {
    "applicability": "shape_only",
    "snapshot_created": false,
    "legacy_readable": true,
    "expected_shape": ["source", "pricing_method", "calculated_unit_price_cents", "calculation_warnings"]
  },
  "legacy_compatibility": {
    "adapter_id": "legacy_saas_calculator_v1",
    "execution_path": "app.services.pricing.calculate_pricing",
    "source": "legacy compatibility value",
    "legacy_dollar_fields": ["selling_price", "suggested_price", "true_cost", "profit_amount"]
  }
}
